topic,count,depth,parent,definition,emoji,examples
Health Insurance Coverage,4,3,Healthcare Outcomes,"Health insurance coverage refers to the financial protection and access to healthcare services provided by insurance companies. Inequities in America often result in disparities in health insurance coverage, with marginalized communities having less access to affordable and comprehensive health insurance plans. This lack of coverage can lead to poorer health outcomes and perpetuate existing health inequities.",💊,"- Many low-income individuals and families in America are unable to afford health insurance coverage, leaving them reliant on costly emergency room visits or going without necessary medical care altogether.
- People with pre-existing conditions, such as cancer or diabetes, may be denied coverage or charged significantly higher premiums due to their health status.
- Many people of color, particularly Black and Latinx communities, face systemic barriers to accessing comprehensive health insurance coverage, perpetuating health disparities and inequities.
- LGBTQ+ individuals may face discrimination in accessing health insurance coverage, with some plans explicitly excluding coverage for gender-affirming treatments or medications.
- Rural communities may have limited options for health insurance coverage, with fewer providers offering plans in these areas and higher premiums due to a lack of competition."
Quality Of Healthcare,3,3,Healthcare Outcomes,"Quality of healthcare refers to the effectiveness, safety, timeliness, patient-centeredness, efficiency, and equity of healthcare services provided to all individuals. It is a crucial aspect of addressing the inequities in America's healthcare system, as it ensures that everyone receives the same standard of care regardless of their race, ethnicity, socio-economic status, or other factors. Improving the quality of healthcare can help reduce disparities and promote better health outcomes for all individuals.",💉,"- African American women are three to four times more likely to die from pregnancy-related complications than white women in the United States, highlighting a disparity in healthcare outcomes.
- A study found that Hispanic children were less likely to receive recommended vaccinations than white children, indicating an inequity in access to preventative healthcare services.
- Research has shown that individuals living in poverty are more likely to experience medical errors and adverse events during hospital stays, suggesting a disparity in the safety of healthcare services provided to different socio-economic groups.
- Patients with limited English proficiency may have difficulty accessing healthcare services and understanding their medical conditions and treatments, leading to lower patient-centeredness in healthcare.
- A report found that racial and ethnic minorities are more likely to receive lower-quality care for certain conditions, such as heart disease and diabetes, further highlighting disparities in healthcare outcomes."
Mental Health,3,3,Healthcare Outcomes,"Mental health refers to a person's overall psychological well-being and the state of their emotional and cognitive functioning. It is a crucial component of healthcare outcomes and is often impacted by social and economic inequities in America. Mental health disparities are prevalent among marginalized populations, highlighting the need for increased access to mental health services and support.",💭,"- Lack of access to affordable mental healthcare for low-income individuals and communities of color
- Higher rates of suicide and substance abuse among LGBTQ+ individuals due to societal discrimination and stigma
- Over-representation of individuals with mental health conditions in the criminal justice system, due to lack of access to treatment and support
- Limited availability of mental health resources in rural areas, leading to increased rates of depression and anxiety
- Disproportionate impact of the COVID-19 pandemic on the mental health of essential workers and communities of color, due to systemic inequities in healthcare and employment."
Maternal And Child Health,3,3,Healthcare Outcomes,"Maternal and child health refers to the wellbeing of mothers and their children, from pregnancy through infancy and childhood. It is a critical aspect of healthcare outcomes and is often used as a measure of healthcare quality. Inequities in maternal and child health outcomes are a significant issue in America, with certain populations experiencing disproportionately high rates of illness and death. Addressing these inequities is essential for improving overall healthcare outcomes and reducing health disparities in America.",🤱,"- Black women in the United States are 3-4 times more likely to die from pregnancy-related complications than white women.
- Children from low-income families are more likely to experience poor health outcomes, including higher rates of obesity and asthma.
- Native American mothers and children have some of the highest rates of infant mortality and poor health outcomes in the country.
- Rural communities often have limited access to maternal and child health services, leading to worse outcomes for mothers and children living in these areas.
- LGBTQ+ individuals who become parents may face discrimination and lack of access to inclusive healthcare services, which can impact maternal and child health outcomes."
Transgender Women,3,3,Transgender,"Transgender women are individuals who were assigned male at birth but identify and live as women. They face significant inequities in America, including discrimination in employment, housing, healthcare, and education, as well as high rates of violence and poverty. These inequities are often compounded for transgender women of color, highlighting the intersectionality of their experiences.",👩‍🦰,"- CeCe McDonald, a transgender woman of color who was imprisoned for defending herself against a racist and transphobic attack, highlighting the disproportionate rates of violence and incarceration faced by transgender women.
- The high rates of murder and violence against transgender women, particularly transgender women of color, which are often underreported and unprosecuted.
- The lack of legal protections for transgender individuals, including the right to use the restroom that aligns with their gender identity, which can lead to harassment and discrimination in public spaces.
- The difficulty transgender women face in accessing healthcare, including gender-affirming care, due to discrimination from healthcare providers and insurance companies.
- The high rates of poverty and unemployment among transgender women, often due to discrimination in hiring and workplace harassment."
Transgender Men,3,3,Transgender,"Transgender men are individuals who were assigned female at birth but identify and live as male. They often face discrimination and inequality in America, such as limited access to healthcare, employment discrimination, and increased risk of violence and harassment. These inequities are rooted in societal norms and beliefs about gender, which can lead to marginalization and exclusion for transgender individuals.",👨‍❤️‍👨,"- Transgender men may face challenges accessing healthcare, including hormone therapy and gender-affirming surgeries.
- Employment discrimination against transgender men can include being denied job opportunities, being paid less than cisgender counterparts, and facing harassment or mistreatment on the job.
- Transgender men are at increased risk of violence and harassment, both in public spaces and in intimate relationships.
- Some transgender men may struggle to access housing, particularly if they are homeless or seeking shelter in gender-segregated facilities.
- Transgender men may also face stigma and discrimination within the LGBTQ+ community, where the experiences of transgender individuals may be overlooked or misunderstood."
Discrimination,3,3,Transgender,"Discrimination refers to the unfair treatment of individuals or groups based on certain characteristics such as race, gender, sexual orientation, or identity. Discrimination against transgender individuals is a subset of the larger issue of inequities in America, which disproportionately affects marginalized communities. It is a manifestation of systemic oppression and reinforces harmful societal attitudes towards those who do not conform to traditional gender norms.",🚫,"- Transgender individuals being denied access to healthcare, including hormone therapy and gender-affirming surgeries
- Discrimination in the workplace, including being denied employment or promotions based on gender identity
- Violence and harassment against transgender individuals, including hate crimes and bullying in schools
- Transgender individuals being denied access to public restrooms or being subject to invasive questioning or searches
- Discrimination in housing, including being denied rental or purchase opportunities based on gender identity."
Men'S Health,6,3,Male,"Men's Health refers to the physical, mental, and emotional well-being of males, specifically in relation to the unique health challenges and disparities they face. Men's health is impacted by various societal factors such as healthcare inequities, cultural norms, and gender roles, which contribute to disparities in health outcomes between men and women. Addressing these inequities is crucial in promoting overall health and well-being for all individuals.",💪,"- Lower life expectancy among men compared to women in America
- Men being less likely to seek medical care and screenings due to cultural norms and gender roles
- Higher rates of suicide and substance abuse among men compared to women in America
- Higher rates of occupational hazards and workplace injuries among men, particularly in physically demanding jobs
- Disparities in access to and quality of healthcare for men, particularly men of color and low-income men."
Patriarchy,3,3,Male,"Patriarchy refers to a social and cultural system where men hold primary power and authority in society, particularly in political, economic, and social spheres. This system perpetuates gender inequities in America and reinforces the subordinate role of women in society.",👨🏻‍💼,"- The gender wage gap, where women earn less than men for the same work
- Lack of representation of women in leadership positions in politics and corporations
- The objectification and sexualization of women in media and advertising
- Gender-based violence, such as domestic violence and sexual assault, disproportionately affecting women
- The expectation for women to take on the majority of unpaid domestic and caregiving work in the home."
Male Mental Health,3,3,Male,"Male mental health refers to the overall psychological and emotional well-being of males, including their ability to manage and cope with stress, anxiety, depression, and other mental health issues. In the context of inequities in America, male mental health is often impacted by societal pressures and expectations surrounding masculinity, including the stigma surrounding seeking help for mental health issues. This can lead to higher rates of suicide and substance abuse among men compared to women.",💪,"- Men are less likely to seek mental health treatment due to societal stigma surrounding seeking help for mental health issues
- Men are more likely to die by suicide than women, with suicide being the 7th leading cause of death for men in America
- Men are more likely to turn to substance abuse as a coping mechanism for mental health issues due to societal pressure to appear strong and self-reliant
- Men are often expected to conform to traditional masculine norms, which can lead to increased stress and anxiety 
- Men are less likely to express their emotions and seek social support, which can negatively impact their mental health"
Male Identity,3,3,Male,"Male identity refers to the social construct and cultural expectations that are associated with being male. It encompasses beliefs, attitudes, behaviors, and practices that are considered masculine and are often reinforced by societal norms and institutions. The concept of male identity is closely linked to gender inequities in America, as traditional gender roles and stereotypes often perpetuate biases and discrimination against women and non-binary individuals.",🧔,"- Men being expected to be the primary breadwinner in a family, leading to disparities in pay and career opportunities for women.
- Toxic masculinity, where men are taught to suppress emotions and resort to violence or aggression to assert dominance, leading to higher rates of domestic violence and mental health issues.
- The expectation for men to be physically strong and tough, leading to higher rates of injuries and fatalities in male-dominated fields like construction and firefighting.
- The notion that men should be sexually aggressive and dominant, leading to a culture of sexual harassment and assault.
- The stigmatization of stay-at-home dads and men in traditionally feminine roles, leading to discrimination and lower social status."
Turner Syndrome (Ts),3,3,Intersex,"Turner Syndrome (Ts) is a genetic condition that affects females, where one of the X chromosomes is either absent or incomplete. It can result in a range of physical and developmental differences. The inequalities in access to healthcare and education experienced by individuals with Ts, particularly those from marginalized communities, highlight the broader inequities in America's healthcare and education systems.",👩‍🦲,"- Limited access to affordable healthcare services for individuals with Turner Syndrome, especially those from marginalized communities.
- Unequal educational opportunities for girls with Turner Syndrome, resulting in lower academic achievement and limited career prospects.
- Discrimination and stigma faced by intersex individuals, including those with Turner Syndrome, in various aspects of their lives, such as employment, housing, and social interactions.
- Lack of awareness and understanding of Turner Syndrome among healthcare providers, leading to misdiagnosis, delayed diagnosis, and inadequate treatment.
- Economic and social barriers that prevent individuals with Turner Syndrome from accessing essential resources and support systems, such as counseling, advocacy, and community outreach programs."
Klinefelter Syndrome,3,3,Intersex,"Klinefelter Syndrome is a genetic condition that occurs in males, where they have an extra X chromosome. This can lead to developmental and hormonal differences, causing infertility, reduced muscle mass, and other health issues. The diagnosis and treatment of Klinefelter Syndrome can be hindered by inequities in the healthcare system, particularly for marginalized communities who may face barriers to accessing quality care.",🧬,"- Infertility and reduced muscle mass are common symptoms in individuals with Klinefelter Syndrome
- Klinefelter Syndrome is caused by an extra X chromosome in males
- Marginalized communities may face barriers in accessing quality healthcare for Klinefelter Syndrome diagnosis and treatment
- Inequities in the healthcare system can hinder the diagnosis and treatment of Klinefelter Syndrome for affected individuals."
Congenital Adrenal Hyperplasia,3,3,Intersex,"Congenital Adrenal Hyperplasia (CAH) is a genetic disorder that affects the adrenal glands and causes them to produce higher levels of androgens (male hormones). This can result in ambiguous genitalia in female infants and other intersex conditions. Inequities in America arise from the lack of knowledge and societal understanding of intersex conditions, which can lead to discrimination and stigmatization of affected individuals.",🧬,"- Ambiguous genitalia in female infants
- Difficulty in identifying gender identity and expression
- Increased risk of developing certain health conditions, such as osteoporosis or cardiovascular disease
- Lack of access to appropriate medical care and support services
- Discrimination and stigmatization in society and within healthcare systems."
Androgen Insensitivity Syndrome,3,3,Intersex,"Androgen Insensitivity Syndrome (AIS) is a genetic condition that affects the development of sexual characteristics in individuals assigned female at birth. It occurs when the body is unable to respond to male hormones (androgens), resulting in the development of female external genitalia despite having XY chromosomes. Individuals with AIS may experience discrimination and inequities in healthcare, education, and employment due to societal expectations around gender and sex.",🚺,"- Individuals with AIS may face difficulties in accessing appropriate healthcare, as medical professionals may not be familiar with the condition or may make assumptions about the individual's gender identity based on their external genitalia.
- AIS can also lead to difficulties in education and employment, as individuals may face discrimination or harassment based on their gender identity or perceived sex.
- Some individuals with AIS may choose to undergo gender-affirming surgeries or hormone therapy to align their physical appearance with their gender identity, but these treatments can be expensive and inaccessible for many people, particularly those without adequate health insurance."
Reproductive Rights,7,3,Female,"Reproductive rights refer to an individual's right to make decisions about their own reproductive health, including access to contraception and safe and legal abortion. These rights are often linked to broader issues of gender inequality and the ability of individuals to control their own bodies and make choices about their lives. In America, reproductive rights have been a contentious issue, with ongoing debates and legal battles over access to reproductive healthcare and services. This has highlighted broader inequities in healthcare and access to resources, particularly for marginalized and underserved communities.",🚺,"- Limited access to affordable contraception, particularly for low-income individuals and those without health insurance
- Laws and regulations restricting access to safe and legal abortion, including waiting periods, mandatory counseling, and clinic closures
- Disproportionate rates of maternal mortality and morbidity for Black and Indigenous women, highlighting disparities in access to quality healthcare and support during pregnancy and childbirth
- Inadequate support for parental leave and affordable childcare, making it difficult for individuals to balance work and family responsibilities and make decisions about when and how to start a family
- Lack of comprehensive sex education in schools, leaving many young people without the information and resources they need to make informed decisions about their reproductive health."
Maternal Mortality,5,3,Female,"Maternal mortality refers to the death of a woman during pregnancy, childbirth, or within 42 days of the end of pregnancy. It is a significant global health issue, and in the United States, it is a reflection of the broader health inequities that disproportionately affect women of color and those from low-income communities. Maternal mortality is a result of a complex interplay of social, economic, and health-related factors, and addressing it requires a comprehensive approach that addresses the root causes of these inequities.",💔,"- Black women in the United States are three to four times more likely to die from pregnancy-related complications compared to white women.
- Women living in rural areas are at higher risk of maternal mortality due to limited access to healthcare facilities and providers.
- Women who are uninsured or underinsured are more likely to experience maternal mortality because they may delay seeking care or have limited access to preventive care.
- Women with chronic health conditions such as hypertension, diabetes, or obesity are at higher risk of maternal mortality. However, these conditions are often exacerbated by social determinants of health such as poverty and lack of access to healthy food and safe housing.
- Women who experience discrimination and bias in healthcare settings, such as being dismissed or not believed when reporting symptoms, may not receive the care they need to prevent maternal mortality."
Political Representation,4,3,Female,"Political representation refers to the process of electing individuals to represent a group of people in the government. It is an essential aspect of democracy, allowing citizens to have a voice in the decisions made by their elected representatives. However, in America, there are significant inequities in political representation, particularly when it comes to gender. Women are often underrepresented in political roles, perpetuating gender disparities in politics and policies that affect women's lives. This lack of representation highlights the ongoing struggle to address inequities in America.",🗳️,"- Women make up only 27% of the U.S. Congress, despite comprising roughly half of the population.
- Of the 50 U.S. governors, only 9 are women.
- Women of color face even greater barriers to political representation, with only 51 women of color serving in the U.S. Congress in history."
Domestic Violence,4,3,Female,"Domestic violence refers to a pattern of behavior where one partner in a relationship seeks to control or harm the other through physical, emotional, or sexual abuse. It is a form of gender-based violence that disproportionately affects women, and is a manifestation of the broader social and economic inequities that exist in America. Domestic violence is a major public health issue that can have serious and long-lasting consequences for survivors, including physical injury, psychological trauma, and financial instability.",🤕,"- Physical abuse, such as hitting, punching, and kicking
- Emotional abuse, such as belittling, name-calling, and controlling behavior
- Sexual abuse, such as rape, forced sexual acts, and coercion
- Financial abuse, such as controlling finances, preventing the victim from working, and stealing money
- Stalking, such as following the victim, showing up uninvited, and making threatening phone calls or messages."
Sexual Harassment And Assault,3,3,Female,"Sexual harassment and assault are forms of gender-based violence that involve unwanted sexual advances, comments, or physical contact. These actions are a manifestation of power imbalances and inequities in society, where individuals with more power use it to control and harm those with less power. Women and marginalized groups are disproportionately affected by sexual harassment and assault, which perpetuate gender inequities and contribute to a culture of violence and discrimination in America.",🚫,"- The #MeToo movement, which highlighted the prevalence of sexual harassment and assault in various industries, including Hollywood, politics, and the workplace.
- The Brock Turner case, in which a former Stanford University student was convicted of sexually assaulting an unconscious woman and received a lenient sentence.
- The Harvey Weinstein case, in which the Hollywood producer was accused by dozens of women of sexual harassment and assault, leading to his conviction and imprisonment."
Intersectionality,3,3,Female,"Intersectionality is a concept that recognizes how various social identities, such as race, gender, sexuality, and class, intersect and overlap, leading to unique experiences of oppression and discrimination. It highlights how different forms of inequality and discrimination intersect to create complex and layered systems of oppression. In America, intersectionality is particularly relevant in addressing the ways in which marginalized groups face multiple forms of discrimination and inequities.",🔀,"- Black women earning less than both black men and white women, highlighting the intersection of race and gender disparities in pay.
- Transgender women of color facing higher rates of violence and discrimination, illustrating the intersection of gender identity, race, and sexuality.
- Indigenous women experiencing disproportionate rates of violence and discrimination, highlighting the intersection of race, gender, and colonialism."
Extreme Weather Events,7,3,Climate Change,"Extreme weather events are severe and unusual weather phenomena that occur due to climate change. These events can cause devastating impacts on the environment, economy, and society, particularly for vulnerable communities who already face inequities in America. Extreme weather events are a subset of environmental inequities that disproportionately affect marginalized populations, exacerbating existing social and economic disparities.",🌪️,"- Hurricane Katrina, which devastated New Orleans in 2005 and disproportionately affected low-income and black communities.
- The California wildfires in 2018, which destroyed thousands of homes and displaced tens of thousands of people, with vulnerable communities such as farmworkers and low-income residents being hit the hardest.
- The Midwest floods in 2019, which caused billions of dollars in damages and displaced thousands of people, disproportionately affecting low-income and rural communities."
