topic,count,depth,parent,definition,emoji,examples
Healthcare,3,1,Inequities in america,"Healthcare refers to the maintenance and improvement of physical, mental, and social well-being through the prevention, diagnosis, treatment, and management of illness and disease. In America, healthcare inequities exist, which result in unequal access to quality healthcare based on factors such as race, income, geography, and insurance status.",🏥,"- Minority groups, such as Black and Hispanic Americans, have higher rates of chronic illnesses like diabetes and hypertension, which can result in poorer health outcomes and higher mortality rates.
- Low-income individuals may not have access to affordable health insurance, leading to delayed or inadequate care.
- Rural communities may have limited access to healthcare facilities, resulting in longer travel times and higher costs to receive medical care.
- Women may face discrimination in healthcare, with higher insurance premiums and limited access to reproductive healthcare services.
- The COVID-19 pandemic has highlighted healthcare inequities, with communities of color experiencing higher rates of infection and death due to systemic racism and underlying health disparities."
Gender,3,1,Inequities in america,"Gender refers to the socially constructed roles, behaviors, and expectations associated with being male or female. It is a fundamental aspect of identity that shapes individuals' experiences and opportunities in society. Inequities in America arise from gender-based discrimination and bias, resulting in disparities in employment, education, healthcare, and other areas of life.",🚹/🚺 (the male/female symbol),"- Women are paid, on average, 82 cents for every dollar earned by men. This pay gap is even wider for women of color.
- Women are more likely to experience sexual harassment and assault in the workplace and in other areas of their lives.
- Men are often expected to conform to traditional masculine norms, which can lead to toxic masculinity and harmful behaviors towards themselves and others.
- Transgender individuals face discrimination and violence, including being denied access to healthcare, employment, and housing. 
- Non-binary individuals are often erased and excluded from discussions and policies related to gender."
Environmental Inequities,3,1,Inequities in america,"Environmental inequities refer to the unequal distribution of environmental harms and benefits among different groups of people. This can be due to factors such as race, income, or geography. These inequities are often seen in America, where marginalized communities are disproportionately impacted by environmental hazards and lack access to clean resources.",🌍,"- Flint, Michigan water crisis: The predominantly Black and low-income community of Flint was exposed to lead-contaminated water for over a year, leading to numerous health issues and deaths.

- Cancer Alley in Louisiana: A stretch of land predominantly inhabited by low-income Black residents has over 150 petrochemical plants and refineries, leading to high rates of cancer and other health issues.

- Standing Rock protests: The Dakota Access Pipeline was planned to run through the land of the Standing Rock Sioux tribe, threatening their water supply and sacred sites. The protests against the pipeline were largely led by Indigenous communities fighting for environmental justice.

- Hurricane Katrina: The hurricane disproportionately affected low-income Black communities in New Orleans, who were abandoned by the government and left to deal with the aftermath themselves.

- Superfund sites: Over 50% of Superfund sites (sites with hazardous waste) are located near low-income communities and communities of color, leading to higher rates of health issues and decreased property values."
Education,3,1,Inequities in america,"Education is the process of imparting knowledge, skills, and values to individuals to enable them to acquire the necessary tools to succeed in life. However, in America, there are significant inequities in access to quality education, which perpetuates social and economic inequalities. These inequities disproportionately affect marginalized groups, including low-income families and people of color, resulting in a lack of upward mobility and perpetuation of the cycle of poverty.",📚,"- Schools in low-income neighborhoods often have fewer resources, such as qualified teachers, up-to-date technology, and adequate facilities, compared to schools in more affluent areas.
- Students of color are disproportionately disciplined and suspended from school, leading to higher dropout rates and increased involvement in the criminal justice system.
- The cost of higher education has risen dramatically in recent years, making it difficult for low-income students to attend college and obtain the necessary skills and credentials for high-paying jobs.
- Students with disabilities often face barriers to accessing quality education, including lack of accommodations and support services.
- The history of systemic racism and discrimination in education has led to a persistent achievement gap between white students and students of color."
Criminal Justice System,3,1,Inequities in america,"The Criminal Justice System refers to the network of laws, law enforcement agencies, courts, and correctional facilities responsible for upholding the laws of society and punishing those who violate them. It has been widely criticized for perpetuating systemic injustices, particularly against marginalized communities in America. These inequities are often rooted in race and socioeconomic status, leading to disproportionate rates of incarceration and harsher sentencing for certain groups.",🚨,"- Black Americans are incarcerated at a rate five times higher than white Americans, despite similar rates of drug use and crime.
- Low-income individuals are less likely to have access to quality legal representation, leading to unfair trials and harsher sentencing.
- The ""war on drugs"" has disproportionately targeted communities of color, leading to mass incarceration and broken families.
- Police brutality and excessive use of force against people of color is a pervasive issue, often leading to wrongful arrests and deaths.
- The cash bail system unfairly penalizes low-income individuals who cannot afford to pay for their release, leading to longer periods of pretrial detention and increased likelihood of pleading guilty to avoid further incarceration."
Criminal Justice Inequities,3,1,Inequities in america,"Criminal justice inequities refer to unfair and unequal treatment within the American criminal justice system based on factors such as race, socio-economic status, and gender. These inequities are a reflection of systemic issues in American society and highlight the ongoing struggle for equality and justice in the United States.",🚫,"- Racial disparities in sentencing, where people of color receive longer sentences for the same crimes as white people
- The disproportionate number of people of color who are incarcerated, despite making up a smaller percentage of the population
- The criminalization of poverty, where low-income individuals are more likely to be arrested and punished for minor offenses such as loitering or panhandling
- The use of cash bail, which disproportionately affects low-income individuals and keeps them in jail before they have even been convicted of a crime
- The over-policing of certain communities, leading to higher rates of arrests and convictions in those areas."
Healthcare Affordability,4,2,Healthcare,"Healthcare affordability refers to the ability of individuals and families to access and pay for necessary medical care without experiencing financial burden or hardship. It is a major component of the overall issue of healthcare inequities in America, as individuals with lower incomes or inadequate insurance coverage are often unable to afford the care they need, leading to disparities in health outcomes and exacerbating existing inequalities.",💰,"- High deductibles and copays for medical services, making it difficult for individuals and families to afford necessary care
- Lack of insurance coverage for preventive care and screenings, leading to delayed diagnosis and treatment of health conditions
- Limited access to affordable prescription drugs, particularly for those without insurance or with inadequate coverage
- Disparities in healthcare quality and outcomes based on income, race, and ethnicity, perpetuating existing inequities in the healthcare system
- Limited availability of affordable healthcare options in rural and low-income areas, making it difficult for individuals in these communities to access necessary medical care."
Health Disparities,4,2,Healthcare,"Health disparities refer to the differences in health outcomes and access to healthcare services among different groups of people, typically based on their socioeconomic status, race, ethnicity, or geographic location. These disparities are a subset of broader social and economic inequities in America, including disparities in education, employment, and income, which can contribute to unequal access to resources that impact health outcomes.",🚫,"- Higher rates of infant mortality and low birth weight babies among African American and Native American populations compared to white populations
- Higher rates of obesity and diabetes among low-income and minority populations compared to wealthier and white populations
- Higher rates of HIV/AIDS among gay and bisexual men compared to heterosexual men and women
- Lack of access to preventative care and screenings for uninsured and underinsured populations, leading to later diagnoses and poorer health outcomes
- Limited access to healthy food options and safe recreational spaces in low-income and minority neighborhoods, contributing to higher rates of chronic diseases like heart disease and cancer."
Medical Debt,3,2,Healthcare,"Medical debt refers to the unpaid bills and expenses incurred by individuals for healthcare services. It is a significant problem in America, where the high cost of healthcare and the lack of insurance coverage often leave individuals struggling to pay for their medical expenses. Medical debt is one of the many inequities in America that disproportionately affects low-income individuals and communities of color, perpetuating the cycle of poverty and health disparities.",💊,"- A person who is uninsured or underinsured may face medical debt after a hospital stay, surgery, or a serious illness.
- A low-income family may struggle to pay for necessary medical treatments for a child with a chronic illness or disability, leading to mounting medical debt.
- A person with a pre-existing condition may face high premiums and out-of-pocket costs for necessary medical care, resulting in medical debt that can be impossible to pay off."
Healthcare Outcomes,3,2,Healthcare,"Healthcare outcomes refer to the overall results or consequences of healthcare interventions or systems on a population's health and well-being. These outcomes can vary greatly depending on factors such as access to care, social determinants of health, and systemic inequities. Inequities in America often lead to disparities in healthcare outcomes, with marginalized populations experiencing poorer health outcomes compared to their more privileged counterparts.",🏥,"- Black women in the United States are three to four times more likely to die from pregnancy-related complications than white women, indicating significant disparities in maternal healthcare outcomes.
- Individuals from lower-income communities often have limited access to quality healthcare facilities, leading to poorer health outcomes and higher mortality rates compared to those in wealthier areas.
- LGBT individuals are more likely to experience healthcare discrimination and have fewer healthcare resources available to them, leading to poorer healthcare outcomes such as higher rates of depression and substance abuse.
- Native American populations have significantly lower life expectancies and higher rates of chronic illnesses such as diabetes, indicating significant disparities in healthcare outcomes compared to other racial groups. 
- Individuals without health insurance or with limited coverage often delay or forgo necessary medical care, leading to poorer health outcomes and higher mortality rates compared to those with comprehensive coverage."
Transgender,3,2,Gender,"Transgender refers to individuals whose gender identity differs from the sex they were assigned at birth. Transgender individuals face numerous inequities in America, including discrimination in employment, healthcare, housing, and access to education. These inequities are often rooted in societal norms and beliefs about gender, leading to marginalization and oppression for transgender individuals.",🏳️‍⚧️,"- A transgender person being denied a job or promotion because of their gender identity
- A transgender person being denied healthcare services, such as hormone therapy or gender confirmation surgery, because of discrimination by healthcare providers or insurance companies
- A transgender person being evicted from their home or denied housing because of their gender identity
- A transgender student being denied the right to use the bathroom or locker room that aligns with their gender identity at school
- A transgender person facing violence or harassment because of their gender identity, such as being verbally abused or physically assaulted."
Male,3,2,Gender,"Male refers to individuals who identify as men or boys. Inequities in America related to gender often result in men having greater access to opportunities and resources than women, perpetuating a system of patriarchy and reinforcing gender-based power imbalances. This can have negative impacts on women and marginalized groups, contributing to ongoing disparities in areas such as employment, education, and healthcare.",👨,"- Men holding a majority of leadership positions in government, corporations, and other institutions
- Men generally earning higher salaries than women for the same job
- Men being less likely to be the primary caregiver for children or elderly relatives
- Men being disproportionately represented in certain industries, such as STEM fields and politics
- Men being less likely to experience sexual harassment or assault than women
- Men being less likely to face discrimination based on their gender or sex
- Men having greater access to healthcare services and resources than women in some cases."
Intersex,3,2,Gender,"Intersex refers to individuals who are born with variations in their sex characteristics that do not fit typical male or female classifications. This can include differences in chromosomes, hormones, or reproductive organs. The medical community often pathologizes intersex traits and performs unnecessary surgeries on intersex infants without their consent, leading to physical and emotional harm. This is one example of the inequities faced by intersex individuals in America, as they are often marginalized and discriminated against due to their differences.",🚻,"- Individuals who are born with both male and female genitalia, or ambiguous genitalia, may be classified as intersex and face discrimination and stigma.
- Intersex individuals may experience medical interventions such as hormone therapy or surgeries to conform to binary gender norms without their consent, leading to physical and emotional harm.
- Intersex athletes may face discrimination and exclusion from sports competitions due to their differences in sex characteristics, despite not having an unfair advantage."
Female,3,2,Gender,"Female refers to the gender category that identifies individuals as biologically female or identifies as female. Inequities related to gender in America have historically disadvantaged and marginalized females, leading to a wide range of social, political, and economic disparities. These inequities continue to affect females in various aspects of life, including education, employment, health care, and political representation.",👩‍🦱,"- The gender pay gap, where women earn less than men for doing the same job
- The lack of paid parental leave, which disproportionately affects women who are more likely to take time off work to care for children
- The underrepresentation of women in leadership positions in various industries, including politics, business, and academia
- The restrictive abortion laws in certain states that limit women's reproductive rights and access to healthcare
- The prevalence of sexual harassment and assault, which disproportionately affects women and can have lasting impacts on their mental health and well-being."
Climate Change,5,2,Environmental Inequities,"Climate Change refers to the long-term alterations in the Earth's climate patterns caused by human activities, such as the burning of fossil fuels and deforestation. It exacerbates environmental inequities, which disproportionately affect marginalized communities in America, including people of color, low-income individuals, and indigenous populations. These communities often face a greater burden of the negative impacts of climate change, such as worsening air quality, extreme weather events, and food and water insecurity, due to historical and ongoing systemic injustices.",🌍,"- Worsening air quality in low-income neighborhoods and communities of color due to the concentration of polluting industries and transportation infrastructure
- Disproportionate impacts of extreme weather events, such as hurricanes and floods, on marginalized communities due to lack of access to resources, infrastructure, and emergency services
- Food and water insecurity in indigenous populations due to the disruption of traditional livelihoods and ecosystems caused by climate change and extractive industries
- Displacement and loss of homes and cultural heritage due to sea level rise and coastal erosion, affecting low-income communities and indigenous populations in particular
- Increased health risks and vulnerabilities to diseases and illnesses associated with climate change, such as heat stroke, respiratory problems, and vector-borne diseases, in marginalized communities with limited access to healthcare and social services."
Environmental Racism,4,2,Environmental Inequities,"Environmental racism refers to the disproportionate impact of environmental hazards and pollution on marginalized communities, particularly communities of color and low-income communities. This form of racism is a subset of broader inequities in America and reflects how systemic discrimination and unequal access to resources and political power can lead to environmental injustice.",🌍🚫👥,"- The Flint water crisis, where predominantly Black and low-income residents were exposed to lead-contaminated water due to government negligence and systemic racism in infrastructure funding and maintenance.
- The location of toxic waste and hazardous facilities, such as landfills and incinerators, in predominantly Black and Latinx neighborhoods, leading to higher rates of asthma, cancer, and other health problems.
- The construction of pipelines and other fossil fuel infrastructure through Indigenous lands without their consent, violating sovereignty and exposing communities to environmental risks and cultural harm.
- Hurricane Katrina, which disproportionately impacted low-income Black communities in New Orleans due to inadequate emergency response and lack of investment in infrastructure and housing.
- The ongoing impact of climate change, which disproportionately affects low-income communities and communities of color who have less access to resources and protection from extreme weather events and rising sea levels."
Toxic Waste,3,2,Environmental Inequities,"Toxic waste refers to hazardous materials that can cause harm to human health and the environment. It is often found in low-income and minority communities, leading to environmental injustices and inequities in America. These communities are disproportionately affected by the negative health impacts of toxic waste, highlighting the intersection of environmental and social injustices in America.",💀,"- The Flint water crisis, where residents of a predominantly black and low-income community were exposed to lead and other contaminants in their drinking water due to cost-cutting measures by local officials.
- The Love Canal disaster, where a chemical waste dump in a working-class neighborhood in Niagara Falls, NY, caused birth defects, cancer, and other health problems for residents.
- The ongoing struggle of the Navajo Nation, where uranium mining and other extractive industries have contaminated the land and water, leading to high rates of cancer and other health issues among Indigenous people."
Natural Disasters,3,2,Environmental Inequities,"Natural disasters refer to catastrophic events caused by natural phenomena such as earthquakes, hurricanes, floods, wildfires, and tornadoes. These disasters can have severe impacts on individuals, communities, and the environment. Natural disasters are often linked to environmental inequities, which are a subset of inequities in America. These inequities refer to the unequal distribution of environmental risks and hazards that disproportionately impact marginalized communities, including low-income households and communities of color.",🌪️,"- Hurricane Katrina: In 2005, Hurricane Katrina devastated the Gulf Coast region, particularly New Orleans, Louisiana. The disaster resulted in over 1,800 deaths and caused billions of dollars in damages. The majority of those impacted were low-income households and communities of color, who were unable to evacuate or lacked access to resources to prepare for the storm.
- California Wildfires: California has experienced an increase in wildfires in recent years, with some of the largest and most destructive fires occurring in 2018 and 2020. These wildfires have caused significant damage to homes, businesses, and the environment, and have disproportionately impacted low-income communities and communities of color, who are more likely to live in areas with higher risk of wildfires.
- Flint Water Crisis: In 2014, the city of Flint, Michigan switched its water source to the Flint River to save money, resulting in lead contamination in the water supply. This crisis disproportionately impacted low-income households and communities of color, who were more likely to rely on the city's water supply and were unable to afford alternative sources of clean water.
- Hurricane Maria: In 2017, Hurricane Maria caused widespread devastation in Puerto Rico, resulting in thousands of deaths and causing billions of dollars in damages. The disaster disproportionately impacted low-income households and communities of color, who were already facing economic and infrastructure challenges prior to the storm. The federal government's slow response to the crisis also highlighted broader inequities in disaster relief and recovery efforts."
Food Deserts,3,2,Environmental Inequities,"Food deserts refer to areas in America where residents have limited access to affordable and healthy food options, such as fresh fruits and vegetables. This lack of access is often due to a combination of factors such as low-income, limited transportation, and a lack of grocery stores or farmers markets in the area. Food deserts are a manifestation of inequities in America, as they disproportionately affect low-income communities and communities of color, perpetuating health disparities and contributing to the overall cycle of poverty.",🌵,"- Areas in Detroit where the nearest grocery store is over a mile away and residents have to rely on convenience stores for their food needs
- Rural areas in the Mississippi Delta where poverty rates are high and grocery stores are scarce, leaving residents with limited options for fresh produce and healthy food
- Low-income neighborhoods in Chicago where the only grocery store closed down, leaving residents with no access to fresh food and forcing them to rely on corner stores with limited options
- Native American reservations where access to healthy food options is limited due to isolation and lack of resources for transportation and infrastructure
- Urban areas in New York City where the cost of living is high and healthy food options are often more expensive, leaving low-income residents with limited choices for nutritious meals."
Access To Education,7,2,Education,"Access to education refers to the ability of individuals to obtain an education, regardless of their socioeconomic status, race, or other factors. Inequities in America often result in certain groups of people having limited access to education, perpetuating cycles of poverty and reinforcing social and economic disparities.",🎓,"- Schools in low-income areas being underfunded and having fewer resources than schools in wealthier areas, leading to a lower quality education for students in those areas.
- Students of color being disproportionately disciplined and suspended from school, leading to a higher likelihood of dropping out and having limited educational opportunities.
- Higher education institutions having significantly higher tuition costs, making it difficult for low-income students to access higher education and obtain degrees that can lead to better job opportunities and higher salaries.
- Limited access to technology and internet in rural or low-income areas, making it difficult for students to participate in online learning and complete assignments.
- Lack of representation and resources for students with disabilities, leading to limited access to education and opportunities for those students."
