topic,count,depth,parent,definition,emoji,examples
Availability,3,3,Access To Education,"Availability refers to the extent to which educational opportunities are accessible to individuals in a particular region or community. It is a critical factor in determining the level of inequities in America, as access to education is often limited by socioeconomic status, race, and geography. Inequitable availability of education perpetuates existing social and economic disparities, and reinforces structural inequalities in American society.",🚪,"- Limited access to quality educational resources in low-income communities
- Racial segregation in schools leading to unequal educational opportunities
- Higher education institutions being unaffordable for many due to skyrocketing tuition costs
- Lack of funding for public schools in marginalized communities, resulting in inadequate facilities and resources
- Inequitable distribution of highly qualified teachers, with wealthier schools having better access to experienced and effective educators."
Teacher Quality,6,3,Quality Of Education,"Teacher Quality refers to the effectiveness, skills, and knowledge of teachers in the classroom, which is crucial to providing a high-quality education to students. It is a critical factor in addressing the inequities in America's education system, as students in low-income areas are more likely to have less experienced and less qualified teachers, leading to disparities in academic achievement. Improving teacher quality can help narrow these gaps and ensure that all students have access to a high-quality education.",🏫,"- Teachers in low-income areas have less experience and are less qualified than teachers in higher-income areas, leading to disparities in academic achievement.
- Teachers who lack cultural competence may not be able to effectively connect with and teach students from diverse backgrounds, further perpetuating inequities in education.
- High teacher turnover rates in low-income areas can disrupt students' learning and lead to a lack of continuity in instruction, further widening the achievement gap."
Standardized Testing,4,3,Quality Of Education,"Standardized Testing refers to the practice of administering uniform tests to students in order to measure their academic performance against a predetermined set of standards. While proponents argue that it promotes accountability and ensures quality of education, critics argue that it perpetuates inequities in America by placing undue emphasis on test scores, which are often influenced by factors such as socio-economic status and race, rather than true academic ability.",📝,"- The SAT and ACT tests, which are often required for college admission and have been criticized for favoring students from affluent backgrounds who can afford test preparation courses.
- The use of standardized tests to evaluate teacher performance, which has been shown to disadvantage teachers in low-income schools where students may face additional challenges outside of the classroom.
- The narrowing of curriculum and instruction in order to focus on test preparation, which can result in students missing out on a well-rounded education that includes the arts, physical education, and other important subjects."
Special Education,3,3,Quality Of Education,"Special education is a specialized form of education that aims to support students with diverse needs that cannot be adequately met in a general education setting. It is a critical component of addressing inequities in America's education system, as it seeks to provide equal opportunities for students with disabilities and other exceptionalities to access quality education. This is especially important as students with disabilities are often among the most disadvantaged groups in the education system.",🧑‍🎓🌟,"- Segregation of students with disabilities in separate classrooms or schools, leading to isolation and limited access to resources and opportunities
- Limited funding and resources for special education programs, resulting in inadequate support for students with disabilities
- Disproportionate representation of students of color and low-income students in special education, potentially due to systemic biases and lack of cultural sensitivity in assessments and interventions
- Inconsistent implementation and enforcement of laws and policies designed to protect the rights of students with disabilities, leading to disparities in access to services and accommodations
- Over-reliance on punitive measures like suspension and expulsion for students with disabilities, rather than providing appropriate support and interventions to address underlying issues."
Educational Technology,3,3,Quality Of Education,"Educational Technology refers to the use of technology to enhance teaching and learning processes, increase access to education, and improve the quality of education. It is a tool that can be used to address the inequities in America's education system, by providing students with equal access to educational resources regardless of their socioeconomic status or geographic location. Through the use of educational technology, students from underserved communities can have access to high-quality education, which can help reduce the achievement gap and promote equity in education.",💻,"- Online learning platforms and courses that provide students with access to educational resources and classes regardless of their location or socioeconomic status.
- Educational apps and software that can help students with different learning abilities and styles to better understand and engage with the material being taught.
- Interactive whiteboards and smartboards that can enhance classroom teaching and help teachers create more engaging and effective lessons.
- Distance learning programs that allow students in remote or underserved areas to attend classes and receive a quality education.
- Virtual reality and augmented reality technologies that can provide students with immersive and interactive learning experiences, making difficult concepts easier to understand."
Early Childhood Education,3,3,Quality Of Education,"Early Childhood Education refers to the educational programs and activities designed to support the development of young children, typically from birth to age eight. It is a critical component of addressing educational inequities in America, as it can provide a foundation for lifelong learning and success, particularly for children from disadvantaged backgrounds. High-quality early childhood education programs can help to close the achievement gap and promote equal opportunities for all children, regardless of their socio-economic status.",👶,"- Lack of access to high-quality early childhood education in low-income communities
- Disparities in funding for early childhood education programs based on the wealth of the school district
- Limited availability of affordable childcare options, particularly for working parents in disadvantaged communities
- Inadequate training and support for early childhood educators, leading to a lower quality of education for young children
- Racial and ethnic disparities in early childhood education outcomes, with children of color often experiencing lower levels of school readiness and academic achievement."
Local Funding,5,3,Funding For Education,"Local funding refers to the financial resources allocated to schools and educational institutions by local governments and communities. This funding is essential for providing quality education to students in different regions of America. However, the distribution of local funding is often unequal, contributing to the overall inequities in America's education system. This inequality can have a significant impact on students' access to resources, quality of education, and future opportunities.",💰,"- Schools in low-income neighborhoods receive less local funding than schools in affluent areas
- Property taxes, which are a main source of local funding, vary greatly depending on the value of the homes in a particular area
- Rural schools often struggle to receive adequate local funding due to a smaller tax base and fewer community resources
- Charter schools, which rely heavily on local funding, can exacerbate inequities if they are not held to the same standards and regulations as traditional public schools."
Title I Funding,4,3,Funding For Education,"Title I funding is a federal program that provides financial assistance to schools with high percentages of low-income students. It aims to reduce the achievement gap between students from low-income families and their peers by providing additional resources and support for these schools. This funding is a response to the inequities in America's education system, which often leaves low-income students behind due to a lack of resources and support.",💰,"- Providing additional resources such as books, technology, and tutoring services to schools with high percentages of low-income students.
- Offering professional development opportunities for teachers in Title I schools to improve their skills and better support their students.
- Funding programs that provide meals, transportation, and other basic needs for low-income students to ensure they can attend school and focus on their education."
Special Education Funding,4,3,Funding For Education,"Special Education Funding refers to financial resources allocated to support the education of students with disabilities. It is a subset of education funding, which is impacted by larger inequities in America, such as unequal access to resources and opportunities based on race, income, and disability status. The goal of special education funding is to ensure that all students, regardless of their abilities, have access to a quality education that meets their individual needs.",💰,"- In some states, schools receive less funding for special education than they are required to spend, leading to a lack of resources and support for students with disabilities.
- Schools in low-income areas often struggle to provide adequate special education services due to a lack of funding and resources.
- Private schools that serve primarily students with disabilities often receive more funding per student than public schools, leading to disparities in access to resources and opportunities.
- Students with disabilities who require more intensive support, such as those with severe physical or cognitive impairments, may require more funding for their education than is currently provided by many school districts.
- The Individuals with Disabilities Education Act (IDEA) provides federal funding for special education, but this funding has not kept pace with the growing number of students who require special education services."
Higher Education Funding,3,3,Funding For Education,"Higher Education Funding refers to the financial support provided to institutions of higher learning such as colleges and universities. It plays a critical role in addressing the inequities in America by ensuring that students from marginalized and underprivileged backgrounds have access to quality education. The funding typically covers tuition fees, research grants, scholarships, and other academic programs that promote excellence in education. However, disparities in higher education funding can exacerbate existing inequities, perpetuating educational inequalities and limiting opportunities for disadvantaged students.",💰,"- Historically Black Colleges and Universities (HBCUs) receive significantly less funding than predominantly white institutions (PWIs), despite serving a disproportionate number of Black students.
- Public universities in states with higher levels of income inequality tend to receive less state funding, leading to higher tuition costs and a greater financial burden on low-income students.
- The federal government's Pell Grant program, which provides need-based financial aid to low-income students, has not kept pace with the rising cost of tuition and other expenses, leaving many students with unmet financial need.
- Private colleges and universities with large endowments are able to provide more generous financial aid packages to students, while smaller institutions with less resources may struggle to provide adequate support.
- Funding for research grants and other academic programs can also perpetuate inequities if they disproportionately benefit certain fields or institutions, furthering the divide between STEM and non-STEM disciplines or favoring elite universities over smaller, regional institutions."
Stop And Frisk,6,3,Racial Profiling,"Stop and Frisk is a controversial policing tactic that involves stopping and searching individuals on the streets without probable cause. It has been widely criticized for disproportionately targeting people of color, leading to racial profiling and exacerbating existing inequities in America's criminal justice system. The practice has been found to violate the Fourth Amendment's protection against unreasonable searches and seizures, and has been a point of contention in discussions around police reform and addressing systemic racism.",🚫,"- In New York City, where stop and frisk was widely used, black and Latino individuals were stopped at higher rates than white individuals, despite white individuals being more likely to be found with contraband.
- A 2019 report found that in Chicago, 72% of all stops made by police officers were of black individuals, despite black individuals making up only 30% of the city's population.
- A study in Philadelphia found that black individuals were stopped at a rate seven times higher than white individuals, and were more likely to be frisked and searched during the stop."
Traffic Stops,5,3,Racial Profiling,"Traffic stops are routine stops made by law enforcement officers to enforce traffic laws and regulations. However, these stops have been found to disproportionately target and affect people of color, highlighting the inequities and discriminatory practices within the criminal justice system in America.",🚔,"- Black drivers being pulled over at higher rates than white drivers for the same traffic violations
- Hispanic drivers being asked to prove their citizenship or immigration status during traffic stops
- Police officers using minor traffic violations as a pretext for searching vehicles and engaging in more invasive searches
- Unjustified use of force against people of color during traffic stops, leading to instances of police brutality and even death
- Increased likelihood of people of color receiving tickets or fines during traffic stops compared to white drivers, leading to financial burdens and potential legal consequences."
Surveillance And Monitoring,3,3,Racial Profiling,"Surveillance and monitoring refer to the process of observing and gathering information about individuals or groups, often with the goal of detecting criminal activity or threats to security. In the context of inequities in America, surveillance and monitoring can perpetuate systemic biases and discrimination, particularly when it targets certain racial or ethnic groups. This can further exacerbate existing inequities and contribute to a culture of distrust and fear.",🕵️‍♂️,"- Stop-and-frisk policies in New York City, which disproportionately targeted Black and Latinx individuals
- The use of facial recognition technology by law enforcement, which has been shown to have higher error rates for people of color
- The monitoring of Muslim communities by law enforcement agencies following the 9/11 attacks
- The collection of data on individuals by credit scoring companies, which can perpetuate economic inequities based on race or ethnicity
- The use of ankle monitors for individuals on parole or probation, which can limit their mobility and opportunities for employment or education."
Police Accountability,7,3,Policing,Police Accountability refers to the responsibility and transparency that law enforcement agencies have towards the public they serve. It is crucial in addressing the systemic injustices and inequalities that exist within the criminal justice system in America. The lack of accountability and oversight can perpetuate discriminatory practices and contribute to the marginalization of communities of color.,👮‍♂️👮‍♀️💡,"- Body-worn cameras: Police departments have implemented the use of body-worn cameras to increase transparency and accountability in interactions between police officers and the public. This allows for the review of incidents and evidence in cases of misconduct or excessive force.
- Citizen review boards: Some cities have established citizen review boards, made up of community members, to oversee police conduct and investigate complaints of misconduct. These boards have the power to recommend disciplinary action or policy changes.
- Independent investigations: In cases of police misconduct or use of excessive force, independent investigations can be conducted by outside agencies to ensure impartiality and accountability.
- Police training and education: Some police departments have implemented training and education programs for officers to address implicit bias, cultural sensitivity, and de-escalation techniques to reduce the use of force.
- Police reform initiatives: Some cities and states have implemented police reform initiatives, such as banning chokeholds, requiring officers to intervene if they witness excessive force, and implementing community policing strategies to build trust and relationships between police and the community."
Stop And Frisk,6,3,Policing,"Stop and Frisk is a controversial policing tactic that involves stopping and searching individuals on the streets without probable cause. It has been widely criticized for disproportionately targeting people of color, leading to racial profiling and exacerbating existing inequities in America's criminal justice system. The practice has been found to violate the Fourth Amendment's protection against unreasonable searches and seizures, and has been a point of contention in discussions around police reform and addressing systemic racism.",🚫,"- In New York City, where stop and frisk was widely used, black and Latino individuals were stopped at higher rates than white individuals, despite white individuals being more likely to be found with contraband.
- A 2019 report found that in Chicago, 72% of all stops made by police officers were of black individuals, despite black individuals making up only 30% of the city's population.
- A study in Philadelphia found that black individuals were stopped at a rate seven times higher than white individuals, and were more likely to be frisked and searched during the stop."
Police Misconduct,6,3,Policing,"Police misconduct is an abuse of power or a violation of the law committed by law enforcement officials who are supposed to uphold justice and protect citizens. It is a reflection of the systemic inequities in America, where marginalized communities are disproportionately affected by police brutality and discrimination. This misconduct undermines public trust in law enforcement and perpetuates the cycle of injustice in our society.",👮‍♂️💥🤬,"- The killing of George Floyd by a police officer who knelt on his neck for over 8 minutes, despite Floyd's pleas that he couldn't breathe. This incident sparked nationwide protests and renewed calls for police reform.
- The shooting of Breonna Taylor, an unarmed Black woman, by police who entered her home without warning and without identifying themselves. No charges were brought against the officers for her death.
- The use of excessive force against peaceful protesters during the Black Lives Matter protests in 2020, including the use of tear gas and rubber bullets. 
- The racial profiling and harassment of people of color by law enforcement, including stop-and-frisk policies that disproportionately target Black and Latino individuals. 
- The planting of evidence or falsification of reports by police officers to secure convictions, particularly in cases involving marginalized communities."
Community Policing,5,3,Policing,"Community Policing is a philosophy of law enforcement that aims to build trust and collaboration between police officers and the community they serve. It recognizes that traditional policing methods may exacerbate existing inequities in America and seeks to address these issues through community engagement and problem-solving. By working together, police officers and community members can create a safer and more just society.",🤝,"- Police officers attending community meetings to discuss crime trends and address community concerns
- Police officers working with community organizations to develop and implement crime prevention programs
- Police officers working with mental health professionals to respond to calls involving individuals in crisis, rather than using force
- Police officers engaging in positive interactions with community members, such as playing basketball or hosting neighborhood cookouts
- Police officers collaborating with schools to address issues such as truancy and bullying, and to build positive relationships with young people."
Police Training,4,3,Policing,"Police training is the process of preparing individuals to serve as law enforcement officers, with the goal of maintaining public safety and preventing crime. Inequities in America can affect police training and the way officers approach their duties, as biases and systemic issues can impact their decision-making and interactions with marginalized communities. Addressing these inequities in training is critical to improving policing and promoting greater equity and justice in society.",👮‍♀️,"- Implicit bias training for officers to recognize and address their own biases towards certain communities
- Incorporating cultural sensitivity and diversity training to better understand and interact with diverse communities
- Incorporating de-escalation and crisis intervention training to reduce use of force and prevent unnecessary harm to civilians
- Addressing the history and current impact of systemic racism in policing and its effect on marginalized communities
- Providing ongoing training and support for officers to ensure they are up-to-date on best practices and new developments in policing and equity."
Police Unions,3,3,Policing,"Police unions are labor organizations that represent police officers in collective bargaining negotiations with their employers, typically city or state governments. They advocate for better wages, benefits, and working conditions for their members. While police unions can play an important role in protecting the rights and interests of officers, they have also been criticized for obstructing police reforms aimed at addressing systemic racial and social injustices in the criminal justice system. This has contributed to the broader issue of inequities in America's law enforcement practices.",👮‍♂️,"- Police unions have been known to fight against police reform measures such as body cameras, civilian oversight boards, and use-of-force policies that aim to reduce police brutality and misconduct.
- Police unions have been criticized for protecting officers who have engaged in abusive behavior, making it difficult for police departments to fire or discipline officers who have committed misconduct.
- In some cases, police unions have successfully lobbied for laws that make it difficult for civilian review boards to investigate police misconduct or for officers to be held accountable for their actions.
- Police unions have also been accused of contributing to the racial and economic disparities in law enforcement by advocating for policies that increase the number of police officers on the streets, leading to over-policing in certain communities."
Militarization Of Police,3,3,Policing,"Militarization of police refers to the increasing use of military equipment, tactics, and training by law enforcement agencies. This trend has been linked to the wider issue of inequities in America, particularly the disproportionate impact of aggressive policing on communities of color. Critics argue that the use of military-style methods and equipment can create a sense of fear and intimidation, leading to a breakdown in trust between police and the communities they serve.",💂‍♂️,"- The use of armored vehicles by police forces in response to protests, such as the use of a BearCat by police in Ferguson, Missouri in 2014.
- The use of military-style tactics during routine police work, such as door-to-door searches in heavily armed SWAT raids.
- The acquisition of surplus military equipment by police departments through programs like the 1033 program, which has provided billions of dollars worth of equipment to police forces across the country.
- The use of military-style uniforms and gear by police officers, such as tactical vests and camouflage clothing.
- The training of police officers by military personnel, including special forces and counter-terrorism units, in courses that emphasize aggressive tactics and the use of force."
