topic,count,depth,parent,definition,emoji,examples
Wildfires,6,3,Climate Change,"Wildfires are natural disasters characterized by uncontrolled fires that often occur in wildland areas. They are linked to climate change, which is a contributing factor to their increasing frequency and intensity. Wildfires are also a subset of environmental inequities, which can disproportionately affect marginalized communities in America. These inequities can stem from various factors, including inadequate resources and infrastructure, social and economic disparities, and historical injustices.",🔥,"- The 2020 California wildfires, which burned over 4 million acres, destroyed thousands of homes, and caused at least 31 deaths. The fires were exacerbated by record-breaking heatwaves and dry conditions, which are linked to climate change.
- The 2018 Camp Fire, which destroyed the town of Paradise, California, and killed 85 people. The fire was caused by faulty electrical equipment owned by Pacific Gas and Electric Company (PG&E), which had a history of neglecting maintenance and safety measures. Many residents of Paradise were low-income or elderly, and lacked the resources to evacuate or rebuild their homes.
- The impact of wildfires on indigenous communities, who often have deep cultural and spiritual ties to the land. In 2018, the Mendocino Complex Fire burned over 459,000 acres in California, including tribal lands belonging to the Pomo and Yuki tribes. The fires destroyed homes, killed livestock, and damaged sacred sites and cultural resources. Indigenous communities also face challenges in accessing resources and support for wildfire prevention and recovery efforts."
Ocean Acidification,6,3,Climate Change,"Ocean Acidification refers to the process of the ocean becoming more acidic due to increased absorption of carbon dioxide from the atmosphere. This phenomenon is a result of climate change, which is a global issue that disproportionately affects marginalized communities in America. Inequities in access to resources and power exacerbate the impacts of ocean acidification on vulnerable populations.",🌊🔥 (combination of wave and fire emoji to represent the destructive impact of ocean acidification),"- The Great Barrier Reef in Australia is experiencing significant damage due to ocean acidification, which is affecting the tourism industry and the livelihoods of local communities who rely on it.
- Shellfish and other marine life are struggling to form their shells and skeletons due to increased acidity, which can lead to population declines and loss of food sources for coastal communities.
- Small island nations, such as those in the Pacific, are at risk of losing their entire economies and cultural identities due to rising sea levels and ocean acidification, which can damage coral reefs and fisheries."
Droughts,6,3,Climate Change,"Droughts are prolonged periods of abnormally dry weather that can lead to water scarcity, crop failure, and ecological disturbances. They are a consequence of climate change, which is a result of environmental inequities, such as pollution and deforestation. Droughts can exacerbate existing inequities in America, particularly for vulnerable communities that lack access to clean water and adequate resources to mitigate the impacts of drought.",🏜️,"- The California drought of 2011-2017, which caused widespread water shortages and crop failures, disproportionately affecting low-income communities and agricultural workers.
- The Flint water crisis in Michigan, which began in 2014 when the city switched its water source to the Flint River, leading to unsafe levels of lead in the drinking water. The crisis disproportionately affected residents of color and low-income communities.
- The Navajo Nation drought, which has been ongoing for over a decade and has led to water shortages and agricultural losses for the Navajo people, who already face significant health and economic disparities."
Flooding,4,3,Climate Change,"Flooding is a natural disaster that occurs when an area is submerged in water due to heavy rainfall or overflowing of rivers, lakes, or oceans. However, flooding can also be a result of environmental inequities, where marginalized communities are disproportionately impacted due to poor infrastructure and inadequate resources. This highlights the issue of inequities in America, where systemic inequalities often lead to certain groups being more vulnerable to the effects of climate change.",💦,"- Hurricane Katrina in 2005, which disproportionately impacted low-income and predominantly Black communities in New Orleans, resulting in loss of life, displacement, and long-term economic and social impacts.
- The ongoing flooding in parts of the Midwest, particularly in rural and agricultural communities, where inadequate infrastructure and lack of resources have left residents struggling to cope with repeated flooding events.
- The Flint water crisis, where the predominantly Black and low-income community of Flint, Michigan was exposed to lead-contaminated water due to inadequate infrastructure and government neglect, leading to health problems and long-term impacts on the community."
Heat Waves,3,3,Climate Change,"Heat waves are extended periods of abnormally high temperatures, which can lead to a range of health impacts such as dehydration, heat exhaustion, and heat stroke. They are a result of climate change and are more likely to occur in areas with environmental inequities, where marginalized communities are disproportionately affected by the impacts of climate change. This highlights the inequities in America, where marginalized communities are often the most vulnerable to the negative effects of climate change.",🌡️,"- The 2021 Pacific Northwest heat wave, which led to hundreds of deaths in Washington, Oregon, and British Columbia, with a disproportionate impact on vulnerable communities such as low-income households and elderly individuals.
- The 1995 Chicago heat wave, which resulted in over 700 deaths, mostly among elderly individuals living in poor neighborhoods with little access to air conditioning or other cooling measures.
- The ongoing heat waves in the southwestern United States, where temperatures regularly reach over 100 degrees Fahrenheit and disproportionately impact communities of color and low-income households who may not have access to air conditioning or other cooling measures."
Air Pollution,6,3,Environmental Racism,"Air pollution refers to the presence of harmful substances in the air that can have negative impacts on human health and the environment. It is a form of environmental racism as it disproportionately affects marginalized communities, particularly low-income and communities of color, who often live in areas with higher levels of pollution. This highlights the broader issue of inequities in America, where certain groups face systemic barriers to accessing resources and experiencing equitable outcomes.",💨,"- Industrial facilities located in low-income and communities of color neighborhoods, emitting high levels of pollutants into the air
- Highways and major transportation routes running through marginalized communities, causing increased traffic and emissions
- Disproportionate levels of asthma and other respiratory illnesses in low-income and communities of color due to air pollution exposure
- Lack of access to green spaces and clean air in urban areas, particularly in marginalized communities where there may be fewer trees and parks
- Inadequate regulations and enforcement of air pollution standards, allowing industrial facilities to continue emitting harmful pollutants without consequence, particularly in marginalized communities."
Water Pollution,4,3,Environmental Racism,"Water pollution is the contamination of water bodies such as lakes, rivers, oceans, and groundwater by harmful substances such as chemical and biological pollutants. It is a form of environmental racism as marginalized communities are disproportionately affected by water pollution due to inequities in access to clean water and sanitation infrastructure. This perpetuates the cycle of inequality in America, where certain groups bear a disproportionate burden of environmental harm.",💧🚮,"- Flint Water Crisis: Residents of Flint, Michigan were exposed to lead-contaminated water for years due to a decision by state officials to switch the city's water source without proper treatment.
- Standing Rock Sioux Tribe vs. Dakota Access Pipeline: The construction of the Dakota Access Pipeline threatened the water supply of the Standing Rock Sioux Tribe, who rely on the Missouri River for drinking water and sacred cultural practices.
- Hurricane Katrina: The hurricane and subsequent flooding disproportionately affected low-income, predominantly Black communities in New Orleans, who were left without access to clean water and adequate sanitation for weeks.
- Love Canal: Residents of the Love Canal neighborhood in Niagara Falls, New York were exposed to toxic waste from a nearby chemical plant, resulting in birth defects, health problems, and displacement.
- Agricultural Runoff: Chemical fertilizers and pesticides used in agriculture can contaminate nearby water sources, disproportionately affecting rural communities and farm workers."
Toxic Waste Sites,3,3,Environmental Racism,"Toxic waste sites refer to locations where hazardous waste materials have been dumped or stored, posing a significant threat to the environment and public health. These sites are often found in low-income and minority communities, leading to environmental racism and further exacerbating existing inequities in America. The impact of toxic waste sites can be devastating, including increased rates of cancer, birth defects, and other health issues.",💀,"- Love Canal, New York: The infamous case of a neighborhood built on a toxic waste dump, causing widespread health issues and birth defects.
- Warren County, North Carolina: The site of a landfill filled with PCB-contaminated waste, which was protested by a predominantly African American community.
- West Oakland, California: An area with high levels of industrial pollution and toxic waste sites, leading to respiratory issues and other health problems for residents.
- Flint, Michigan: The city's water crisis, caused by lead contamination in the water supply, disproportionately affected low-income and minority communities.
- Cancer Alley, Louisiana: A stretch of the Mississippi River with numerous chemical plants and toxic waste sites, impacting the health of nearby communities, which are predominantly African American."
Medical Waste,6,3,Toxic Waste,"Medical waste refers to any waste generated in healthcare facilities, such as hospitals, clinics, and laboratories, that may pose a threat to human health or the environment. This waste includes items contaminated with bodily fluids, sharps, and expired medications. The improper disposal of medical waste can lead to environmental pollution and human health risks, disproportionately affecting low-income and minority communities, highlighting the issue of environmental inequities in America.",💉,"- Contaminated syringes and needles
- Expired medications
- Blood-soaked gauze and bandages
- Unused chemotherapy drugs
- Radioactive materials used in medical imaging
- Chemicals used in medical research
- Human tissues and organs
- Medical equipment contaminated with infectious agents"
Industrial Waste,4,3,Toxic Waste,"Industrial waste refers to the hazardous byproducts of industrial processes that pose a threat to human health and the environment. It is a significant contributor to environmental inequities, particularly in marginalized communities where industrial facilities are often located. The disproportionate burden of exposure to industrial waste in these communities is a manifestation of broader inequities in America.",🏭💀,"- Toxic chemicals and pollutants released into the air and water by nearby factories and manufacturing facilities
- Dumping of hazardous waste materials in landfills or bodies of water, which can contaminate the surrounding environment
- Improper disposal of electronic waste, such as old computers and phones, which can release harmful chemicals into the air and water if not recycled properly
- Abandoned industrial sites that are left to decay and release toxic substances into the environment, often in low-income communities that lack the resources to address the problem
- The use of pesticides and other chemicals in agriculture, which can lead to soil contamination and run-off into nearby water sources."
Wildfires,5,3,Natural Disasters,"Wildfires are natural disasters characterized by uncontrolled fires that often occur in wildland areas. They are linked to climate change, which is a contributing factor to their increasing frequency and intensity. Wildfires are also a subset of environmental inequities, which can disproportionately affect marginalized communities in America. These inequities can stem from various factors, including inadequate resources and infrastructure, social and economic disparities, and historical injustices.",🔥,"- The 2020 California wildfires, which burned over 4 million acres, destroyed thousands of homes, and caused at least 31 deaths. The fires were exacerbated by record-breaking heatwaves and dry conditions, which are linked to climate change.
- The 2018 Camp Fire, which destroyed the town of Paradise, California, and killed 85 people. The fire was caused by faulty electrical equipment owned by Pacific Gas and Electric Company (PG&E), which had a history of neglecting maintenance and safety measures. Many residents of Paradise were low-income or elderly, and lacked the resources to evacuate or rebuild their homes.
- The impact of wildfires on indigenous communities, who often have deep cultural and spiritual ties to the land. In 2018, the Mendocino Complex Fire burned over 459,000 acres in California, including tribal lands belonging to the Pomo and Yuki tribes. The fires destroyed homes, killed livestock, and damaged sacred sites and cultural resources. Indigenous communities also face challenges in accessing resources and support for wildfire prevention and recovery efforts."
Tornadoes,5,3,Natural Disasters,"Tornadoes are a type of natural disaster characterized by rotating columns of air that can cause extensive damage to buildings and infrastructure. In the United States, tornadoes disproportionately affect low-income and minority communities, highlighting the environmental inequities that exist within the country. These communities often lack the resources and infrastructure necessary to mitigate the impact of tornadoes, leading to greater damage and loss of life.",🌪️,"- The May 2013 tornado outbreak in Oklahoma caused extensive damage to low-income housing areas, including the predominantly African American community of Little Axe.
- After the 2011 Joplin tornado in Missouri, it was found that low-income households were less likely to have access to safe rooms or storm shelters, putting them at greater risk during severe weather events.
- In 2019, a tornado swept through the predominantly Latino community of Miami, Florida, causing significant damage to homes and businesses. Many residents did not have insurance or the financial resources to rebuild."
Landslides,5,3,Natural Disasters,"Landslides refer to the movement of rock, soil, or debris down a slope due to gravity. They can cause significant damage to infrastructure and properties, and sometimes lead to loss of life. Landslides can be triggered by various factors, including heavy rainfall, earthquakes, and human activities such as construction and deforestation. Inequities in America can exacerbate the impacts of landslides, as marginalized communities often lack the resources and infrastructure to cope with and recover from these disasters.",🏔️,"- The 2014 Oso landslide in Washington State, which killed 43 people and destroyed 49 homes.
- The 2018 Kilauea eruption in Hawaii, which triggered numerous landslides that destroyed homes and infrastructure in the affected areas.
- The ongoing issue of landslides in Puerto Rico, which have been exacerbated by Hurricane Maria and the island's struggling infrastructure and economy."
Hurricanes,5,3,Natural Disasters,"Hurricanes are powerful and destructive tropical storms that can cause significant damage to coastal communities. They are a natural disaster that can exacerbate existing inequalities in America, such as racial and economic disparities, as vulnerable communities are often hit the hardest and have fewer resources to recover from the aftermath. The impact of hurricanes highlights the need for addressing inequities in America, including access to resources and infrastructure, to mitigate their effects.",🌀,"- Hurricane Katrina in 2005, which devastated New Orleans and disproportionately affected low-income and African American communities.
- Hurricane Maria in 2017, which caused extensive damage in Puerto Rico and highlighted the island's lack of resources and inadequate infrastructure.
- Hurricane Harvey in 2017, which caused flooding in Houston and exposed existing disparities in housing and access to healthcare for marginalized communities."
Floods,5,3,Natural Disasters,"Floods are a type of natural disaster caused by excessive water accumulation in an area. They can lead to displacement, loss of property, and even loss of life. Inequities in America can exacerbate the impact of floods, as low-income and marginalized communities often lack the resources and infrastructure to prepare for and recover from such events.",💦,"- Hurricane Katrina, which devastated New Orleans in 2005 and disproportionately affected low-income and black communities
- The 2019 Midwest floods, which caused billions of dollars in damages and displaced thousands of people, many of whom were already struggling financially
- The ongoing water crisis in Flint, Michigan, where residents, many of whom are low-income and people of color, have been exposed to lead-contaminated water for years, exacerbating the impact of any flooding in the area."
Earthquakes,5,3,Natural Disasters,"Earthquakes are natural disasters that occur when the Earth's tectonic plates shift, causing the ground to shake and potentially causing damage to infrastructure and loss of life. Inequities in America can be exacerbated by earthquakes, as marginalized communities may have less access to resources and support to recover from the aftermath of such disasters.",🌋,"- The 1989 Loma Prieta earthquake in California disproportionately affected low-income neighborhoods, which suffered more damage and slower recovery than wealthier areas.
- The 2010 earthquake in Haiti, one of the deadliest in history, highlighted the country's existing economic and social disparities and the lack of preparedness and resources to respond to the disaster.
- The 2011 earthquake and tsunami in Japan caused widespread devastation and displacement, but also revealed discrepancies in the government's response and support for affected communities, particularly indigenous populations and those living near the Fukushima nuclear plant."
Droughts,5,3,Natural Disasters,"Droughts are prolonged periods of abnormally dry weather that can lead to water scarcity, crop failure, and ecological disturbances. They are a consequence of climate change, which is a result of environmental inequities, such as pollution and deforestation. Droughts can exacerbate existing inequities in America, particularly for vulnerable communities that lack access to clean water and adequate resources to mitigate the impacts of drought.",🏜️,"- The California drought of 2011-2017, which caused widespread water shortages and crop failures, disproportionately affecting low-income communities and agricultural workers.
- The Flint water crisis in Michigan, which began in 2014 when the city switched its water source to the Flint River, leading to unsafe levels of lead in the drinking water. The crisis disproportionately affected residents of color and low-income communities.
- The Navajo Nation drought, which has been ongoing for over a decade and has led to water shortages and agricultural losses for the Navajo people, who already face significant health and economic disparities."
Tsunamis,3,3,Natural Disasters,"Tsunamis are natural disasters that occur when there is a sudden displacement of water, usually caused by an earthquake or volcanic eruption. While tsunamis are not directly related to inequities in America, the impact of these disasters can disproportionately affect marginalized communities who may not have access to resources or support systems to recover from the devastation.",🌊,"- The 2004 Indian Ocean tsunami disproportionately affected poor and marginalized communities in Indonesia, Sri Lanka, and other countries, causing widespread displacement and loss of life.
- The 2011 Tohoku earthquake and tsunami in Japan caused significant damage to coastal communities, many of which were already struggling with economic and social inequities.
- In the United States, Hurricane Katrina and the resulting flooding in New Orleans in 2005 highlighted deep-seated inequities in access to resources and support systems, particularly for low-income and Black communities."
Geographic Distribution Of Food Deserts,3,3,Food Deserts,"Geographic distribution of food deserts refers to the uneven access to fresh and healthy food options in certain areas of the United States. This is a result of environmental inequities, where lower-income and minority communities are often located in areas with limited grocery stores and healthy food options, leading to further inequities in America.",🌵,"- In Detroit, Michigan, a city with a high poverty rate, only eight grocery stores serve the entire population of over 700,000 people, leading to many residents relying on convenience stores and fast food restaurants for their meals.
- In rural areas of the United States, residents may have to travel long distances to reach a grocery store with fresh produce, leading to limited access to healthy food options.
- Native American reservations often lack access to fresh and healthy food options, with many relying on processed and packaged foods from convenience stores due to the lack of grocery stores in their communities."
Affordability,4,3,Access To Education,"Affordability refers to the ability of individuals or communities to access education without financial burden or hardship. It is a critical factor in addressing inequities in America, as lack of affordability often disproportionately affects marginalized and low-income populations, perpetuating disparities in educational attainment and opportunities.",💰,"- High tuition fees for higher education institutions that limit access to students from low-income families
- Limited availability of financial aid or scholarships for students who cannot afford to pay for their education
- Expensive textbooks and resources required for coursework that can add significant financial burden on students
- Cost of transportation and housing for students who need to travel to attend school or live on campus, which can be a significant financial barrier for low-income students
- Lack of investment in public schools in low-income neighborhoods, leading to inadequate resources and lower quality education for students in those areas."
Quality,3,3,Access To Education,"Quality refers to the standard or level of excellence that is expected or desired. In the context of education, quality refers to the level of access and resources that students have to receive a comprehensive and equitable education. Inequities in America often result in disparities in the quality of education that students receive based on factors such as race, income, and location. Addressing these inequities and improving the quality of education for all students is essential for achieving greater equity and opportunity in America.",🌟,"- Unequal distribution of resources such as textbooks, technology, and teachers among schools in different neighborhoods
- Disparities in funding for schools in low-income areas compared to wealthier areas
- Limited access to advanced courses and extracurricular activities for students from marginalized communities
- Racial and ethnic disparities in discipline and punishment within schools
- Lack of diversity and representation in the curriculum and teaching staff."
Discrimination,3,3,Access To Education,"Discrimination refers to the unfair treatment of individuals or groups based on certain characteristics such as race, gender, sexual orientation, or identity. Discrimination against transgender individuals is a subset of the larger issue of inequities in America, which disproportionately affects marginalized communities. It is a manifestation of systemic oppression and reinforces harmful societal attitudes towards those who do not conform to traditional gender norms.",🚫,"- Transgender individuals being denied access to healthcare, including hormone therapy and gender-affirming surgeries
- Discrimination in the workplace, including being denied employment or promotions based on gender identity
- Violence and harassment against transgender individuals, including hate crimes and bullying in schools
- Transgender individuals being denied access to public restrooms or being subject to invasive questioning or searches
- Discrimination in housing, including being denied rental or purchase opportunities based on gender identity."
